{
  "goal": "Turn meeting notes into a human-reviewed list of explicit actions.",
  "success_criteria": [
    "Each action cites a verbatim passage.",
    "Unstated owners and dates remain unknown."
  ],
  "constraints": [
    "Do not send messages or assign work automatically."
  ],
  "catalog": [],
  "feedback": []
}
