{
  "goal": "Design an Op to run and manage all my business workflows forever.",
  "success_criteria": [
    "Each action cites a verbatim passage.",
    "Unstated owners and dates remain unknown."
  ],
  "constraints": [
    "Do not send messages or assign work automatically."
  ],
  "catalog": [],
  "feedback": []
}
